[
  {
    "id": "merkur_2026-01-12_sgt-vereinsheim",
    "media": "merkur",
    "date": "2026-01-12",
    "title": "Drei Vorschläge für neues Vereinsheim",
    "url": "https://www.merkur.de/lokales/freising/moosburg-ort29088/sgt-istanbul-moosburg-drei-vorschlaege-fuer-neues-vereinsheim-clubvertreter-reagieren-ueberrascht-94124799.html"
  },
  {
    "id": "merkur_2026-02-02_sgt-vereinsheim",
    "media": "merkur",
    "date": "2026-02-02",
    "title": "Hängepartie beendet",
    "url": "https://www.merkur.de/lokales/freising/moosburg-ort29088/haengepartie-beendet-fussballer-duerfen-neues-vereinsheim-auf-moosburger-stadtgrund-bauen-94163882.html"
  },
  {
    "id": "br_2025-09_falschparken-plan",
    "media": "br",
    "date": "2025-09-01",
    "title": "quer: Legales Falschparken",
    "url": "https://www.ardmediathek.de/video/quer-mit-christoph-suess/legales-falschparken-moosburger-stadtplatz-wird-zugestellt/br/Y3JpZDovL2JyLmRlL2Jyb2FkY2FzdC9GMjAyNVdPMDIyMjY2QTAvc2VjdGlvbi9iZTA1ZGJmNC04Y2QyLTQyZDAtODg4Yi03NDZmYzg0ZDAyMDU"
  },
  {
    "id": "sz_2025-09_falschparken-plan",
    "media": "sz",
    "date": "2025-09-01",
    "title": "Falschparken am Plan",
    "url": "https://www.sueddeutsche.de/muenchen/freising/moosburg-falschparken-platz-plan-li.3390834"
  },
  {
    "id": "merkur_2026-01-12_parken-plan",
    "media": "merkur",
    "date": "2026-01-12",
    "title": "Stadt verzichtet vorerst auf Strafzettel",
    "url": "https://www.merkur.de/lokales/freising/moosburg-ort29088/parken-am-plan-bald-verstaerkt-im-winter-stadt-moosburg-verzichtet-vorerst-auf-strafzettel-94140705.html"
  },
  {
    "id": "merkur_2026-02-23_parken-plan",
    "media": "merkur",
    "date": "2026-02-23",
    "title": "Falschparker müssen ab Montag blechen",
    "url": "https://www.merkur.de/lokales/freising/moosburg-ort29088/nach-posse-um-moosburger-plan-falschparker-muessen-ab-montag-blechen-94190182.html"
  },
  {
    "id": "merkur_2026-02-02_studentenwohnheim",
    "media": "merkur",
    "date": "2026-02-02",
    "title": "Stadt klagt wegen Studentenwohnungen",
    "url": "https://www.merkur.de/lokales/freising/moosburg-ort29088/151-studentenwohnungen-gegen-landratsamt-ueberhaupt-nicht-kontrollierbar-stadt-klagt-wegen-94153206.html"
  },
  {
    "id": "merkur_2026-02-02_baugenehmigungen",
    "media": "merkur",
    "date": "2026-02-02",
    "title": "Ärger über Baugenehmigungen des Landratsamts",
    "url": "https://www.merkur.de/lokales/freising/moosburg-ort29088/immer-katastrophaler-und-verrueckter-moosburger-aerger-ueber-baugenehmigungen-des-landratsamts-94165710.html"
  },
  {
    "id": "merkur_2025-12-01_fahrradschutzstreifen",
    "media": "merkur",
    "date": "2025-12-01",
    "title": "Fahrradschutzstreifen auf Probe beschlossen",
    "url": "https://www.merkur.de/lokales/freising/moosburg-ort29088/trotz-bedenken-stadt-beschliesst-fahrradschutzstreifen-auf-probe-94072881.html"
  },
  {
    "id": "merkur_2026-05-13_konstituierende-sitzung",
    "media": "merkur",
    "date": "2026-05-13",
    "title": "Moosburgs neue Bürgermeister-Stellvertreter: Ein Deal wahrt den Frieden zum Stadtrat-Start",
    "url": "https://www.merkur.de/lokales/freising/moosburg-ort29088/moosburgs-neue-buergermeister-stellvertreter-ein-deal-wahrt-den-frieden-zum-stadtrat-start-94304143.html"
  },
  {
    "id": "merkur_2026-02-23_schulweg",
    "media": "merkur",
    "date": "2026-02-23",
    "title": "Maßnahmen sollen Schulweg sicherer machen",
    "url": "https://www.merkur.de/lokales/freising/moosburg-ort29088/gefahrenzone-an-moosburger-schulzentrum-kleine-massnahmen-sollen-schulweg-sicherer-machen-94194456.html"
  },
  {
    "id": "merkur_2025-11-10_kreisverkehr",
    "media": "merkur",
    "date": "2025-11-10",
    "title": "Neuer Kreisverkehr beschlossen",
    "url": "https://www.merkur.de/lokales/freising/moosburg-ort29088/totalsperre-trotz-grosser-bedenken-neuer-kreisverkehr-in-moosburg-beschlossen-autofahrern-droht-94032557.html"
  },
  {
    "id": "mz_2025-11-10_kreisverkehr",
    "media": "mz",
    "date": "2025-11-10",
    "title": "Kreisverkehr zur Entlastung des Verkehrs",
    "url": "https://www.idowa.de/regionen/moosburg/kreiseln-zur-entlastung-des-verkehrs-in-moosburg-art-365250"
  },
  {
    "id": "merkur_2025-12-01_wirtschaftsfoerderer",
    "media": "merkur",
    "date": "2025-12-01",
    "title": "Wirtschaftsförderer soll es richten",
    "url": "https://www.merkur.de/lokales/freising/moosburg-ort29088/gewerbesteuer-flaute-und-leerstand-jetzt-soll-es-in-moosburg-ein-wirtschaftsfoerderer-richten-94067543.html"
  },
  {
    "id": "merkur_2024-12-09_legal-wall",
    "media": "merkur",
    "date": "2024-12-09",
    "title": "Legal Wall für Moosburgs Graffitikünstler gefordert",
    "url": "https://www.merkur.de/lokales/freising/moosburg-ort29088/legal-wall-fuer-moosburgs-graffitikuenstler-gefordert-93457156.html"
  },
  {
    "id": "sz_2024-12-17_legal-wall",
    "media": "sz",
    "date": "2024-12-17",
    "title": "Legal Wall für Moosburg beschlossen",
    "url": "https://www.sueddeutsche.de/muenchen/freising/moosburg-sprayer-graffiti-legal-wall-wand-lux.5qeDpTapZoqAyBpRe1aLGu"
  },
  {
    "id": "sz_2024-03_erfrischungsgeld",
    "media": "sz",
    "date": "2024-03-04",
    "title": "Erfrischungsgeld für Wahlhelfer",
    "url": "https://www.sueddeutsche.de/muenchen/freising/moosburg-europawahl-wahlhelfer-erfrischungsgeld-zusatzleistungen-1.6453020"
  },
  {
    "id": "merkur_2024-06_kitagebuehren",
    "media": "merkur",
    "date": "2024-06-10",
    "title": "Kinderbetreuung in Moosburg wird teurer",
    "url": "https://www.merkur.de/lokales/freising/moosburg-ort29088/kitagebuehren-kinderbetreuung-in-moosburg-wird-teurer-buergermeister-ich-denke-das-ist-zumutbar-93123706.html"
  },
  {
    "id": "sz_2024-06_kitas-arbeitsmarktzulage",
    "media": "sz",
    "date": "2024-06-10",
    "title": "Kitas, Personalgewinnung, Gebührenerhöhung",
    "url": "https://www.sueddeutsche.de/muenchen/freising/moosburg-stadtrat-kitas-personalgewinnung-arbeitsmarktzulage-kindergartengebuehren-erhoehung-lux.9MD2NeWAwJXXzbYHDJmd8D"
  },
  {
    "id": "sz_2024-05_windenergie",
    "media": "sz",
    "date": "2024-05-06",
    "title": "Windenergie-Vorrangflächen: Bürgergenossenschaft für Kirchamper",
    "url": "https://www.sueddeutsche.de/muenchen/freising/moosburg-windenergie-vorrangflaechen-kirchamper-windrad-buerger-energiegenossenschaft-regionalplan-muenchen-1.7012405"
  },
  {
    "id": "sz_2021-10-25_hundesteuer",
    "media": "sz",
    "date": "2021-10-25",
    "title": "Neue Satzung mit zusätzlichen Reinigungskosten",
    "url": "https://www.sueddeutsche.de/muenchen/freising/neue-satzung-in-moosburg-zusaetzliche-reinigungskosten-1.5451743"
  },
  {
    "id": "mz_2021-02-08_ganztagsbetreuung",
    "media": "mz",
    "date": "2021-02-08",
    "title": "Stadtrat beschließt offene Ganztagsbetreuung für Grundschule Süd",
    "url": "https://www.idowa.de/regionen/moosburg/stadtrat-beschliesst-offene-ganztagsbetreuung-fuer-grundschule-sued-art-151274"
  },
  {
    "id": "mz_2020-10-26_plan-tiefgarage",
    "media": "mz",
    "date": "2020-10-26",
    "title": "Es geht weiter mit der Plan-Neugestaltung",
    "url": "https://www.idowa.de/regionen/moosburg/es-geht-weiter-mit-plan-neugestaltung-art-136108"
  },
  {
    "id": "merkur_2020-10-26_plan-tiefgarage",
    "media": "merkur",
    "date": "2020-10-26",
    "title": "Jetzt steht fest, wann Moosburgs Plan umgebaut wird",
    "url": "https://www.merkur.de/lokales/freising/moosburg-ort29088/jetzt-steht-fest-wann-moosburgs-plan-umgebaut-wird-tiefgarage-neu-diskutiert-90082163.html"
  },
  {
    "id": "sz_2023-01-12_granitpflaster",
    "media": "sz",
    "date": "2023-01-12",
    "title": "Kompromiss beim Pflaster: gebunden und offen verfugt",
    "url": "https://www.sueddeutsche.de/muenchen/freising/moosburg-stadtrat-plan-neugestaltung-pflaster-kompromiss-verfugung-gebunden-offen-1.5777812"
  },
  {
    "id": "merkur_2023-04-17_schloss-aschwiese",
    "media": "merkur",
    "date": "2023-04-17",
    "title": "Was passiert mit Schloss-Asch-Wiese und altem Sportplatz?",
    "url": "https://www.merkur.de/lokales/freising/moosburg-ort29088/gedankenspiele-fuer-moosburgs-filetstueck-was-passiert-mit-schloss-asch-wiese-und-altem-sportplatz-92221907.html"
  },
  {
    "id": "merkur_2024-11-04_hallenbad-kinder",
    "media": "merkur",
    "date": "2024-11-04",
    "title": "Kinder in den Ferien gratis ins Hallenbad – geteilte Meinungen",
    "url": "https://www.merkur.de/lokales/freising/moosburg-ort29088/moosburg-kinder-in-den-ferien-gratis-ins-neue-hallenbad-geteilte-meinungen-im-stadtrat-93394613.html"
  },
  {
    "id": "mz_2024-11-04_hallenbad-kinder",
    "media": "mz",
    "date": "2024-11-04",
    "title": "Gratis Badespaß für Kinder vertagt",
    "url": "https://www.idowa.de/regionen/moosburg/gratis-badespass-fuer-kinder-in-moosburg-vertagt-art-307180"
  },
  {
    "id": "merkur_2026-02-23_bplan-aich",
    "media": "merkur",
    "date": "2026-02-23",
    "title": "Bauvorhaben im Villenviertel stößt auf Ablehnung",
    "url": "https://www.merkur.de/lokales/freising/moosburg-ort29088/sorge-vor-vierkantbolzen-im-quartier-bauvorhaben-im-moosburger-villenviertel-stoesst-auf-ablehnung-94196267.html"
  },
  {
    "id": "merkur_2023-06-26_mieterhoehung",
    "media": "merkur",
    "date": "2023-06-26",
    "title": "Stadtrat spricht sich für höhere Mieten aus",
    "url": "https://www.merkur.de/lokales/freising/moosburg-ort29088/stadtrat-spricht-sich-fuer-hoehere-mieten-aus-92374996.html"
  },
  {
    "id": "sz_2023-01-12_pflaster-mehrkosten",
    "media": "sz",
    "date": "2023-01-12",
    "title": "Feste Verfugung: Streit um die Mehrkosten",
    "url": "https://www.sueddeutsche.de/muenchen/freising/moosburg-stadtrat-plan-umgestaltung-pflaster-feste-verfugung-mehrkosten-1.5732083"
  },
  {
    "id": "merkur_2023-04-24_ausschussgroesse",
    "media": "merkur",
    "date": "2023-04-24",